{
  "schemaVersion":"1.0","slug":"jm-trucking","status":"review","templateId":"forge",
  "business":{"name":"J&M Trucking Logistics LLC","industry":"Trucking & logistics","tagline":"Your freight. Our focus.","summary":"J&M Trucking Logistics LLC is based in Birmingham, Alabama."},
  "contact":{"phone":{"value":"(205) 771-8234","status":"draft","source":"Existing customer website source"},"email":{"value":"diamuhammad@yahoo.com","status":"draft","source":"Existing customer website source"},"address":{"value":"Birmingham, Alabama","status":"draft","source":"Existing customer website source"},"serviceAreas":{"value":"","status":"missing"}},
  "services":[{"name":"Trucking inquiries","description":"Share freight, pickup, destination and timing so J&M can discuss your requirements.","status":"draft","source":"Existing customer website source"},{"name":"Logistics conversations","description":"Talk through shipment locations, access and special considerations.","status":"draft","source":"Existing customer website source"},{"name":"Freight quote requests","description":"Send shipment details to begin a quote conversation; pricing and availability require confirmation.","status":"draft","source":"Existing customer website source"}],
  "pages":{"home":{"eyebrow":"Trucking & logistics · Birmingham, Alabama","headline":"Your freight. Our focus.","intro":"Every shipment starts with a conversation. Connect with J&M Trucking Logistics to discuss your freight and plan the next step.","ctaLabel":"Request a quote"},"services":{"headline":"Your shipment. Let’s work through the details.","intro":"Start with what you need to move. J&M will discuss the shipment and confirm what is possible."},"about":{"headline":"It starts with a conversation.","paragraphs":["J&M Trucking Logistics LLC is based in Birmingham, Alabama.","Reach out to discuss freight, route, timing and the details that need attention. Equipment, cargo suitability and coverage are confirmed directly."]},"contact":{"headline":"Let’s get the conversation moving.","intro":"Have a question or shipment in mind? Contact J&M Trucking Logistics to discuss the next step."},"privacy":{"headline":"Privacy Policy","body":["This preview policy is pending customer review.","Form submissions are in internal test mode and notify only the authorized Red Spectrum test inbox. They do not reach J&M Trucking Logistics.","Do not submit sensitive personal or financial information through the website form."]}},
  "branding":{"primary":"#D95A28","secondary":"#12243B","accent":"#F2A65A","surface":"#F8F5EF","logoPath":"/customers/jm-trucking/brand/logo-light.svg","faviconPath":"/customers/jm-trucking/brand/favicon.png"},
  "images":{"hero":{"src":"/customers/jm-trucking/images/highway-hero.webp","alt":"Illustrative unbranded semi truck on a country highway at sunrise.","width":1536,"height":1024},"gallery":[{"src":"/customers/jm-trucking/images/freight-detail.webp","alt":"Illustrative freight trailer beside loading bays.","width":1536,"height":1024},{"src":"/customers/jm-trucking/images/alabama-road.webp","alt":"Illustrative freight truck on a wooded road.","width":1536,"height":1024}]},
  "seo":{"title":"J&M Trucking Logistics | Birmingham Freight","description":"Discuss trucking, logistics and freight quote requests with J&M Trucking Logistics in Birmingham, Alabama."},"schema":{"type":"LocalBusiness","description":"Trucking and logistics business based in Birmingham, Alabama."},"form":{"provider":"sendgrid","mode":"test","recipientConfirmed":true,"testPassed":false},"myndy":{"agentName":"J&M assistant","greeting":"Contact J&M Trucking Logistics to discuss your freight.","avatarBrief":"No Myndy agent configured.","knowledgeContextPath":"customers/jm-trucking/myndy/agent-context.md","embed":{"enabled":false,"agentId":"","scriptUrl":""}}
}
