{
  "schemaVersion": "1.0",
  "slug": "{{SLUG}}",
  "status": "draft",
  "templateId": "forge",
  "business": {
    "name": "{{BUSINESS_NAME}}",
    "industry": "Draft industry",
    "tagline": "Draft tagline",
    "summary": "Draft business summary. Replace with verified customer-approved content."
  },
  "contact": {
    "phone": { "value": "", "status": "missing" },
    "email": { "value": "", "status": "missing" },
    "address": { "value": "", "status": "missing" },
    "serviceAreas": { "value": "", "status": "missing" }
  },
  "services": [
    { "name": "Draft service", "description": "Replace with a verified service description.", "status": "draft" }
  ],
  "pages": {
    "home": { "eyebrow": "Draft introduction", "headline": "Draft customer headline", "intro": "Replace with verified customer-approved introductory copy.", "ctaLabel": "Request information" },
    "services": { "headline": "Services built around customer needs", "intro": "Replace with a verified overview of the customer’s services." },
    "about": { "headline": "About {{BUSINESS_NAME}}", "paragraphs": ["Draft company story. Do not add unsupported history, credentials, or claims."] },
    "contact": { "headline": "Start a conversation", "intro": "Use verified contact details and explain the confirmed next step." },
    "privacy": { "headline": "Privacy Policy", "body": ["Draft privacy content. Review for actual tools, retention practices, jurisdiction, and legal requirements before approval."] }
  },
  "branding": {
    "primary": "#BD1E2C",
    "secondary": "#101828",
    "accent": "#F4B8BE",
    "surface": "#F5F6F8",
    "logoPath": "",
    "faviconPath": ""
  },
  "images": {
    "hero": { "src": "/customers/{{SLUG}}/hero.jpg", "alt": "Draft image description", "width": 1600, "height": 1000 },
    "gallery": []
  },
  "seo": { "title": "{{BUSINESS_NAME}} | Draft website preview", "description": "Draft search description. Replace with accurate, customer-approved content." },
  "schema": { "type": "LocalBusiness", "description": "Draft structured-data description. Replace before approval." },
  "form": { "provider": "sendgrid", "mode": "disabled", "recipientConfirmed": false, "testPassed": false },
  "myndy": {
    "agentName": "Draft agent name",
    "greeting": "Draft greeting",
    "avatarBrief": "Draft industry-appropriate avatar brief",
    "knowledgeContextPath": "customers/{{SLUG}}/myndy/agent-context.md",
    "embed": { "enabled": false, "agentId": "", "scriptUrl": "" }
  }
}
