{
  "schemaVersion":"1.0","slug":"360-vitality-fitness","status":"review","templateId":"stillwater",
  "business":{"name":"360 Vitality Fitness LLC","industry":"Fitness, mobility & nutrition coaching","tagline":"Build Strength. Move Better.","summary":"360 Vitality Fitness LLC provides online fitness, nutrition and mobility coaching, with Chicago sessions by request."},
  "contact":{"phone":{"value":"(877) 696-7333","status":"draft","source":"Existing customer website source"},"email":{"value":"get360vitalityfitness@gmail.com","status":"draft","source":"Existing customer website source"},"address":{"value":"Chicago, IL","status":"draft","source":"Existing customer website source"},"serviceAreas":{"value":"Online coaching · Chicago sessions by request","status":"draft","source":"Existing customer website source"}},
  "services":[{"name":"Online Fitness Coaching","description":"Personalized workouts and ongoing guidance that work around your schedule.","status":"draft","source":"Existing customer website source"},{"name":"Personal Training","description":"One-on-one guidance shaped around your goals, ability and routine.","status":"draft","source":"Existing customer website source"},{"name":"Nutrition Coaching","description":"Practical nutrition accountability without restrictive promises or extremes.","status":"draft","source":"Existing customer website source"},{"name":"Body Assessment","description":"A fitness-focused starting point for understanding movement and planning next steps.","status":"draft","source":"Existing customer website source"}],
  "pages":{"home":{"eyebrow":"Online coaching · Chicago sessions by request","headline":"Build strength. Move better. Feel like yourself again.","intro":"Personalized online fitness, nutrition and mobility coaching for busy adults who want sustainable progress without extreme routines.","ctaLabel":"Request a consultation"},"services":{"headline":"Support for your next healthy step.","intro":"Explore practical coaching shaped around your goals, ability and routine."},"about":{"headline":"Meet Angela Williams.","paragraphs":["Angela Williams founded 360 Vitality Fitness LLC to help people approach fitness with confidence, clarity and consistency.","Credentials and customer-approved headshot remain pending confirmation before publication."]},"contact":{"headline":"Ready to take your next healthy step?","intro":"Tell 360 Vitality what you want to improve and identify a practical place to begin."},"privacy":{"headline":"Privacy Policy","body":["This preview policy is pending customer review.","Form submissions are in internal test mode and notify only the authorized Red Spectrum test inbox. They do not reach 360 Vitality Fitness.","This website does not provide medical advice. Consult an appropriate professional regarding individual health concerns."]}},
  "branding":{"primary":"#1D6B62","secondary":"#173C43","accent":"#E6A95C","surface":"#FAF8F2","logoPath":"/customers/360-vitality-fitness/brand/logo.png","faviconPath":"/customers/360-vitality-fitness/brand/favicon.svg"},
  "images":{"hero":{"src":"/customers/360-vitality-fitness/images/hero.png","alt":"Illustrative fitness coach guiding adults through approachable strength exercises.","width":1600,"height":1067},"gallery":[{"src":"/customers/360-vitality-fitness/images/assessment.webp","alt":"Illustrative balance assessment for fitness coaching.","width":1536,"height":1024},{"src":"/customers/360-vitality-fitness/images/coaching.webp","alt":"Illustrative online fitness coaching at home.","width":1536,"height":1024}]},
  "seo":{"title":"360 Vitality Fitness | Coaching & Mobility","description":"Explore online fitness, mobility and nutrition coaching with 360 Vitality Fitness LLC."},"schema":{"type":"HealthAndBeautyBusiness","description":"Fitness, mobility and nutrition coaching for busy adults."},"form":{"provider":"sendgrid","mode":"test","recipientConfirmed":true,"testPassed":false},"myndy":{"agentName":"360 Vitality assistant","greeting":"Contact 360 Vitality Fitness to discuss coaching.","avatarBrief":"No Myndy agent configured.","knowledgeContextPath":"customers/360-vitality-fitness/myndy/agent-context.md","embed":{"enabled":false,"agentId":"","scriptUrl":""}}
}
